{
  "envelope_version": "1.0",
  "doc_type": "question",
  "subject": "BAN",
  "class_level": 5,
  "address": {
    "anchor_word": "Unit",
    "number": 14,
    "title": "পাঠ ১৪ — কুপোকাত"
  },
  "curation_tag": "FLEXIBLE",
  "review_status": "draft",
  "tags": {
    "topic_tag": "TOP-BAN-C5-01",
    "bloom_level": "Understand",
    "difficulty": "medium",
    "paper_role": "short"
  },
  "provenance": {
    "source_project": "P04",
    "author": "Principal",
    "content_version": "v1",
    "source_filename": "C5_BAN_U14_QuestionBank_v1.json"
  },
  "payload": {
    "qid": "QP-BAN-C5-U14-Q38",
    "topic_tag": "TOP-BAN-C5-01",
    "ref19_topic_id": "BAN-WORDREL",
    "question_text": "'কুপোকাত' নাটকে ব্যবহৃত 'ক্ষুদ্রকায়' শব্দের বিপরীত শব্দ লেখো।",
    "question_type": "short_answer",
    "paper_role": "short",
    "bloom_level": "Understand",
    "difficulty": "medium",
    "tier": "tier1",
    "marks": 1,
    "chapter_ref": "পাঠ ১৪ — কুপোকাত",
    "answer_key": {
      "accepted": [
        "বৃহৎ",
        "বিশাল",
        "বড়ো"
      ],
      "model_note": "শিক্ষকের দেওয়া ভাষাগত উত্তর গ্রহণযোগ্য — এটি বাংলা ভাষার সাধারণ তথ্য, পাঠে এর উত্তর দেওয়া নেই। উদ্দীপক পাঠ ১৪ থেকেই নেওয়া। কাছাকাছি অর্থের যেকোনো শুদ্ধ উত্তর গ্রহণযোগ্য।"
    }
  }
}