{
  "envelope_version": "1.0",
  "doc_type": "question",
  "subject": "BAN",
  "class_level": 5,
  "address": {
    "anchor_word": "Unit",
    "number": 13,
    "title": "পাঠ ১৩ — পাখির মতো"
  },
  "curation_tag": "FLEXIBLE",
  "review_status": "draft",
  "tags": {
    "topic_tag": "TOP-BAN-C5-01",
    "bloom_level": "Remember",
    "difficulty": "easy",
    "paper_role": "short"
  },
  "provenance": {
    "source_project": "P04",
    "author": "Principal",
    "content_version": "v1",
    "source_filename": "C5_BAN_U13_QuestionBank_v1.json"
  },
  "payload": {
    "qid": "QP-BAN-C5-U13-Q48",
    "topic_tag": "TOP-BAN-C5-01",
    "ref19_topic_id": "BAN-WORDREL",
    "question_text": "'পাখির মতো' কবিতায় ব্যবহৃত 'শহর' শব্দের বিপরীত শব্দ লেখো।",
    "question_type": "short_answer",
    "paper_role": "short",
    "bloom_level": "Remember",
    "difficulty": "easy",
    "tier": "tier1",
    "marks": 1,
    "chapter_ref": "পাঠ ১৩ — পাখির মতো",
    "answer_key": {
      "accepted": [
        "গ্রাম",
        "গাঁ",
        "পল্লি"
      ],
      "model_note": "এই উত্তরকুঞ্জি শিক্ষকের দেওয়া — বাংলা ভাষার সাধারণ তথ্য, পাঠে এর উত্তর দেওয়া নেই (CD-136)। উদ্দীপক পাঠ ১৩ থেকেই নেওয়া। কাছাকাছি অর্থের যেকোনো শুদ্ধ উত্তর গ্রহণযোগ্য।"
    }
  }
}