{
  "envelope_version": "1.0",
  "doc_type": "question",
  "subject": "BAN",
  "class_level": 5,
  "address": {
    "anchor_word": "Unit",
    "number": 22,
    "title": "পাঠ ২২ — আমরা তোমাদের ভুলব না"
  },
  "curation_tag": "FLEXIBLE",
  "review_status": "draft",
  "tags": {
    "topic_tag": "TOP-BAN-C5-01",
    "bloom_level": "Remember",
    "difficulty": "easy",
    "paper_role": "short"
  },
  "provenance": {
    "source_project": "P04",
    "author": "Principal",
    "content_version": "1.0",
    "source_filename": "C5_BAN_Source_22.md"
  },
  "payload": {
    "qid": "QP-BAN-C5-U22-Q04",
    "topic_tag": "TOP-BAN-C5-01",
    "ref19_topic_id": "BAN-VOCAB",
    "question_text": "\"তারপর গণ-অভ্যুত্থান ঘটে।\" — বাক্যটিতে ব্যবহৃত 'গণ-অভ্যুত্থান' শব্দের অর্থ লেখো।",
    "question_type": "short_answer",
    "paper_role": "short",
    "bloom_level": "Remember",
    "difficulty": "easy",
    "tier": "tier1",
    "marks": 1,
    "chapter_ref": "পাঠ ২২ — আমরা তোমাদের ভুলব না",
    "answer_key": {
      "accepted": [
        "দেশের মানুষের সম্মিলিত আন্দোলন"
      ]
    }
  }
}