{
  "envelope_version": "1.0",
  "doc_type": "question",
  "subject": "BAN",
  "class_level": 5,
  "address": {
    "anchor_word": "Unit",
    "number": 15,
    "title": "পাঠ ১৫ — সংকল্প"
  },
  "curation_tag": "FLEXIBLE",
  "review_status": "draft",
  "tags": {
    "topic_tag": "TOP-BAN-C5-05",
    "bloom_level": "Remember",
    "difficulty": "easy",
    "paper_role": "short"
  },
  "provenance": {
    "source_project": "P04",
    "author": "Principal",
    "content_version": "v1",
    "source_filename": "C5_BAN_U15_QuestionBank_v1.json"
  },
  "payload": {
    "qid": "QP-BAN-C5-U15-Q28",
    "topic_tag": "TOP-BAN-C5-05",
    "ref19_topic_id": "BAN-POEM",
    "question_text": "'বিশ্ব-জগৎ দেখব আমি আপন হাতের ______ পুরে।' — শূন্যস্থান পূরণ করো।",
    "question_type": "fill_blank",
    "paper_role": "short",
    "bloom_level": "Remember",
    "difficulty": "easy",
    "tier": "tier1",
    "marks": 1,
    "chapter_ref": "পাঠ ১৫ — সংকল্প",
    "blanks": [
      {
        "blank_no": 1,
        "accepted": [
          "মুঠায়"
        ]
      }
    ]
  }
}