{
  "envelope_version": "1.0",
  "doc_type": "question",
  "subject": "BAN",
  "class_level": 5,
  "address": {
    "anchor_word": "Unit",
    "number": 13,
    "title": "পাঠ ১৩ — পাখির মতো"
  },
  "curation_tag": "FLEXIBLE",
  "review_status": "draft",
  "tags": {
    "topic_tag": "TOP-BAN-C5-05",
    "bloom_level": "Understand",
    "difficulty": "medium",
    "paper_role": "short"
  },
  "provenance": {
    "source_project": "P04",
    "author": "Principal",
    "content_version": "v1",
    "source_filename": "C5_BAN_U13_QuestionBank_v1.json"
  },
  "payload": {
    "qid": "QP-BAN-C5-U13-Q12",
    "topic_tag": "TOP-BAN-C5-05",
    "ref19_topic_id": "BAN-POEM",
    "question_text": "'পাখির মতো' কবিতায় 'দুধভরা ওই চাঁদের বাটি' বলতে কী বোঝানো হয়েছে?",
    "question_type": "short_answer",
    "paper_role": "short",
    "bloom_level": "Understand",
    "difficulty": "medium",
    "tier": "tier1",
    "marks": 2,
    "chapter_ref": "পাঠ ১৩ — পাখির মতো",
    "answer_key": {
      "accepted": [
        "পূর্ণিমার চাঁদকে বোঝানো হয়েছে"
      ],
      "model_note": "পাঠের 'অর্থ জেনে নিই' ছকের অর্থই মূল উত্তর।"
    }
  }
}