{
  "envelope_version": "1.0",
  "doc_type": "question",
  "subject": "BAN",
  "class_level": 5,
  "address": {
    "anchor_word": "Unit",
    "number": 13,
    "title": "পাঠ ১৩ — পাখির মতো"
  },
  "curation_tag": "FLEXIBLE",
  "review_status": "draft",
  "tags": {
    "topic_tag": "TOP-BAN-C5-05",
    "bloom_level": "Understand",
    "difficulty": "medium",
    "paper_role": "short"
  },
  "provenance": {
    "source_project": "P04",
    "author": "Principal",
    "content_version": "v1",
    "source_filename": "C5_BAN_U13_QuestionBank_v1.json"
  },
  "payload": {
    "qid": "QP-BAN-C5-U13-Q123",
    "topic_tag": "TOP-BAN-C5-05",
    "ref19_topic_id": "BAN-POEM",
    "question_text": "শেষ স্তবকে কবি নিজেকে 'তোমরা'র থেকে আলাদা করছেন কীভাবে?",
    "question_type": "short_answer",
    "paper_role": "short",
    "bloom_level": "Understand",
    "difficulty": "medium",
    "tier": "tier1",
    "marks": 2,
    "chapter_ref": "পাঠ ১৩ — পাখির মতো",
    "answer_key": {
      "accepted": [
        "তোমরা পড়া শিখছে মানুষ হওয়ার জন্য, আর কবি বলছেন তিনি না হয় পাখিই হবেন — এই তুলনাতেই তিনি নিজেকে আলাদা করছেন।"
      ],
      "model_note": "স্তবকের দুই দিক — অন্যদের পড়া শেখা আর কবির পাখি হতে চাওয়া — ধরা পড়লেই পূর্ণ নম্বর। 'তোমরা' কারা তা কবিতা নাম ধরে বলেনি, তাই তাদের পরিচয় লেখার দরকার নেই।"
    }
  }
}