{
  "envelope_version": "1.0",
  "doc_type": "question",
  "subject": "BAN",
  "class_level": 5,
  "address": {
    "anchor_word": "Unit",
    "number": 19,
    "title": "পাঠ ১৯ — ভাষার খেলা"
  },
  "curation_tag": "FLEXIBLE",
  "review_status": "draft",
  "tags": {
    "topic_tag": "TOP-BAN-C5-02",
    "bloom_level": "Understand",
    "difficulty": "medium",
    "paper_role": "mcq"
  },
  "provenance": {
    "source_project": "P04",
    "author": "Principal",
    "content_version": "1.0",
    "source_filename": "C5_Bangla_Source_13-23.md"
  },
  "payload": {
    "qid": "QP-BAN-C5-U19-Q22",
    "topic_tag": "TOP-BAN-C5-02",
    "ref19_topic_id": "BAN-SENTENCE",
    "question_text": "'একটি বাক্য ভেঙে দুটি' — পাঠ ১৯-এর এই অনুশীলনীটি কোন ধরনের কাজ?",
    "question_type": "mcq",
    "paper_role": "mcq",
    "options": [
      {
        "option_id": "ক",
        "text": "বাক্য গঠন",
        "is_correct": true
      },
      {
        "option_id": "খ",
        "text": "শব্দার্থ",
        "is_correct": false,
        "why_wrong": "শব্দার্থে শব্দের মানে লিখতে হয়, বাক্য ভাঙতে হয় না।"
      },
      {
        "option_id": "গ",
        "text": "যুক্তবর্ণ",
        "is_correct": false,
        "why_wrong": "যুক্তবর্ণে বর্ণ ভাঙা হয়, বাক্য নয়।"
      },
      {
        "option_id": "ঘ",
        "text": "মূলভাব",
        "is_correct": false,
        "why_wrong": "মূলভাব লিখতে একটি মূল পাঠ লাগে, যা এই পাঠে নেই।"
      }
    ],
    "bloom_level": "Understand",
    "difficulty": "medium",
    "tier": "tier1",
    "marks": 1,
    "chapter_ref": "পাঠ ১৯ — ভাষার খেলা"
  }
}