{
  "envelope_version": "1.0",
  "doc_type": "question",
  "subject": "BAN",
  "class_level": 5,
  "address": {
    "anchor_word": "Unit",
    "number": 17,
    "title": "পাঠ ১৭ — মাটির নিচে পুরানো নগর"
  },
  "curation_tag": "FLEXIBLE",
  "review_status": "draft",
  "tags": {
    "topic_tag": "TOP-BAN-C5-01",
    "bloom_level": "Remember",
    "difficulty": "easy",
    "paper_role": "short"
  },
  "provenance": {
    "source_project": "P04",
    "author": "Principal",
    "content_version": "1.0",
    "source_filename": "C5_Bangla_Source_13-23.md"
  },
  "payload": {
    "qid": "QP-BAN-C5-U17-Q41",
    "topic_tag": "TOP-BAN-C5-01",
    "ref19_topic_id": "BAN-WORDREL",
    "question_text": "পাঠে ব্যবহৃত 'অভিজ্ঞ' শব্দের বিপরীত শব্দ লেখো।",
    "question_type": "short_answer",
    "paper_role": "short",
    "bloom_level": "Remember",
    "difficulty": "easy",
    "tier": "tier1",
    "marks": 1,
    "chapter_ref": "পাঠ ১৭ — মাটির নিচে পুরানো নগর",
    "answer_key": {
      "accepted": [
        "অনভিজ্ঞ"
      ],
      "model_note": "এই উত্তরকুঞ্জি শিক্ষকের দেওয়া — বাংলা ভাষার সাধারণ তথ্য, পাঠে এর উত্তর দেওয়া নেই (CD-136)। উদ্দীপক পাঠ ১৭ থেকেই নেওয়া। কাছাকাছি অর্থের যেকোনো শুদ্ধ উত্তর গ্রহণযোগ্য।"
    }
  }
}