{
  "envelope_version": "1.0",
  "doc_type": "question",
  "subject": "BAN",
  "class_level": 5,
  "address": {
    "anchor_word": "Unit",
    "number": 18,
    "title": "পাঠ ১৮ — ইচ্ছামতী"
  },
  "curation_tag": "FLEXIBLE",
  "review_status": "draft",
  "tags": {
    "topic_tag": "TOP-BAN-C5-05",
    "bloom_level": "Understand",
    "difficulty": "medium",
    "paper_role": "short"
  },
  "provenance": {
    "source_project": "P04",
    "author": "Principal",
    "content_version": "1.0",
    "source_filename": "C5_Bangla_Source_13-23.md"
  },
  "payload": {
    "qid": "QP-BAN-C5-U18-Q47",
    "topic_tag": "TOP-BAN-C5-05",
    "ref19_topic_id": "BAN-POEM",
    "question_text": "গাঁয়ের কোন মানুষদের নদী চেনে বলে কবি লিখেছেন?",
    "question_type": "short_answer",
    "paper_role": "short",
    "bloom_level": "Understand",
    "difficulty": "medium",
    "tier": "tier1",
    "marks": 2,
    "chapter_ref": "পাঠ ১৮ — ইচ্ছামতী",
    "answer_key": {
      "accepted": [
        "যারা জলে নাইতে আসে, আর যারা গোরু মহিষ নিয়ে সাঁতরে ওপার যায় — এই মানুষদের নদী চেনে।"
      ]
    }
  }
}