{
  "envelope_version": "1.0",
  "doc_type": "question",
  "subject": "BAN",
  "class_level": 5,
  "address": {
    "anchor_word": "Unit",
    "number": 15,
    "title": "পাঠ ১৫ — সংকল্প"
  },
  "curation_tag": "FLEXIBLE",
  "review_status": "draft",
  "tags": {
    "topic_tag": "TOP-BAN-C5-01",
    "bloom_level": "Remember",
    "difficulty": "easy",
    "paper_role": "short"
  },
  "provenance": {
    "source_project": "P04",
    "author": "Principal",
    "content_version": "v1",
    "source_filename": "C5_BAN_U15_QuestionBank_v1.json"
  },
  "payload": {
    "qid": "QP-BAN-C5-U15-Q09",
    "topic_tag": "TOP-BAN-C5-01",
    "ref19_topic_id": "BAN-VOCAB",
    "question_text": "'সংকল্প' কবিতায় ব্যবহৃত 'জাপটে' শব্দের অর্থ লেখো।",
    "question_type": "short_answer",
    "paper_role": "short",
    "bloom_level": "Remember",
    "difficulty": "easy",
    "tier": "tier1",
    "marks": 1,
    "chapter_ref": "পাঠ ১৫ — সংকল্প",
    "answer_key": {
      "accepted": [
        "দুহাতে জড়িয়ে"
      ]
    }
  }
}