{
  "envelope_version": "1.0",
  "doc_type": "question",
  "subject": "BAN",
  "class_level": 5,
  "address": {
    "anchor_word": "Unit",
    "number": 16,
    "title": "পাঠ ১৬ — স্মরণীয় যাঁরা বরণীয় যাঁরা"
  },
  "curation_tag": "FLEXIBLE",
  "review_status": "draft",
  "tags": {
    "topic_tag": "TOP-BAN-C5-14",
    "bloom_level": "Understand",
    "difficulty": "medium",
    "paper_role": "short"
  },
  "provenance": {
    "source_project": "P04",
    "author": "Principal",
    "content_version": "v1",
    "source_filename": "C5_BAN_U16_QuestionBank_v1.json"
  },
  "payload": {
    "qid": "QP-BAN-C5-U16-Q50",
    "topic_tag": "TOP-BAN-C5-14",
    "ref19_topic_id": "BAN-BIOGRAPHY",
    "question_text": "দেশের জন্য যাঁরা প্রাণ দিয়েছেন তাঁদের আমরা কেন স্মরণ করব?",
    "question_type": "short_answer",
    "paper_role": "short",
    "bloom_level": "Understand",
    "difficulty": "medium",
    "tier": "tier1",
    "marks": 2,
    "chapter_ref": "পাঠ ১৬ — স্মরণীয় যাঁরা বরণীয় যাঁরা",
    "answer_key": {
      "accepted": [
        "তাঁদের আত্মদানেই দেশ স্বাধীন হয়েছে। তাঁদের কাজ ও অবদান জানলে আমরাও দায়িত্ববান হতে শিখি, আর তাঁদের রেখে যাওয়া কাজ এগিয়ে নিতে পারি।"
      ],
      "model_note": "মূল তথ্য ও ভাবটি ধরা পড়লেই পূর্ণ নম্বর; শব্দে শব্দে মিল থাকা জরুরি নয়।"
    }
  }
}