{
  "envelope_version": "1.0",
  "doc_type": "question",
  "subject": "BAN",
  "class_level": 5,
  "address": {
    "anchor_word": "Unit",
    "number": 19,
    "title": "পাঠ ১৯ — ভাষার খেলা"
  },
  "curation_tag": "FLEXIBLE",
  "review_status": "draft",
  "tags": {
    "topic_tag": "TOP-BAN-C5-01",
    "bloom_level": "Understand",
    "difficulty": "easy",
    "paper_role": "short"
  },
  "provenance": {
    "source_project": "P04",
    "author": "Principal",
    "content_version": "1.0",
    "source_filename": "C5_Bangla_Source_13-23.md"
  },
  "payload": {
    "qid": "QP-BAN-C5-U19-Q27",
    "topic_tag": "TOP-BAN-C5-01",
    "ref19_topic_id": "BAN-WORDREL",
    "question_text": "'উপর' — পাঠ ১৯-এর শব্দতালিকায় থাকা এই শব্দটির বিপরীত শব্দ লেখো।",
    "question_type": "short_answer",
    "paper_role": "short",
    "bloom_level": "Understand",
    "difficulty": "easy",
    "tier": "tier1",
    "marks": 1,
    "chapter_ref": "পাঠ ১৯ — ভাষার খেলা",
    "answer_key": {
      "accepted": [
        "নিচ",
        "নিচে"
      ],
      "model_note": "এই উত্তরকুঞ্জি শিক্ষকের দেওয়া (CD-136(b)) — এটি বাংলা ভাষার সাধারণ তথ্য, পাঠ ১৯ এর উত্তর ছাপে না। উদ্দীপকের শব্দ পাঠ ১৯ থেকেই নেওয়া। কাছাকাছি অর্থের যেকোনো শুদ্ধ বিপরীত শব্দ গ্রহণযোগ্য।"
    }
  }
}