{
  "envelope_version": "1.0",
  "doc_type": "question",
  "subject": "BAN",
  "class_level": 5,
  "address": {
    "anchor_word": "Unit",
    "number": 14,
    "title": "পাঠ ১৪ — কুপোকাত"
  },
  "curation_tag": "FLEXIBLE",
  "review_status": "draft",
  "tags": {
    "topic_tag": "TOP-BAN-C5-01",
    "bloom_level": "Understand",
    "difficulty": "easy",
    "paper_role": "short"
  },
  "provenance": {
    "source_project": "P04",
    "author": "Principal",
    "content_version": "v1",
    "source_filename": "C5_BAN_U14_QuestionBank_v1.json"
  },
  "payload": {
    "qid": "QP-BAN-C5-U14-Q62",
    "topic_tag": "TOP-BAN-C5-01",
    "ref19_topic_id": "BAN-PARTSPEECH",
    "question_text": "'বাঘ প্রতিদিন নির্বিচারে বহু পশু হত্যা করে' — এখানে 'করে' শব্দটি কোন পদ? নির্ণয় করো।",
    "question_type": "short_answer",
    "paper_role": "short",
    "bloom_level": "Understand",
    "difficulty": "easy",
    "tier": "tier1",
    "marks": 1,
    "chapter_ref": "পাঠ ১৪ — কুপোকাত",
    "answer_key": {
      "accepted": [
        "কাজ-শব্দ",
        "ক্রিয়া",
        "ক্রিয়া পদ"
      ],
      "model_note": "এই উত্তরকুঞ্জি শিক্ষকের দেওয়া — এটি বাংলা ভাষার সাধারণ তথ্য, পাঠে এর উত্তর দেওয়া নেই। উদ্দীপক পাঠ ১৪ থেকেই নেওয়া। নির্দিষ্ট উত্তরই লাগবে — এই কাজে কাছাকাছি অর্থের কোনো বিকল্প নেই, গৃহীত তালিকার বাইরে কিছু নেওয়া যাবে না। বইয়ের নিজের নামই প্রথম গৃহীত উত্তর — নাম-শব্দ / কাজ-শব্দ। 'বিশেষ্য'/'ক্রিয়া'ও গ্রহণযোগ্য; 'নামপদ' নয়।"
    }
  }
}