{
  "envelope_version": "1.0",
  "doc_type": "question",
  "subject": "BAN",
  "class_level": 5,
  "address": {
    "anchor_word": "Unit",
    "number": 21,
    "title": "পাঠ ২১ — বিদায় হজের ভাষণ"
  },
  "curation_tag": "KEEP_AS_IS",
  "review_status": "draft",
  "tags": {
    "topic_tag": "TOP-BAN-C5-07",
    "bloom_level": "Remember",
    "difficulty": "easy",
    "paper_role": "mcq"
  },
  "provenance": {
    "source_project": "P04",
    "author": "Principal",
    "content_version": "v1",
    "source_filename": "C5_BAN_U21_QuestionBank_v1.json"
  },
  "payload": {
    "topic_tag": "TOP-BAN-C5-07",
    "ref19_topic_id": "BAN-INFOTEXT",
    "question_text": "মহানবি হজরত মুহাম্মদ (স) মক্কায় যেতে চাইলে কারা জড়ো হলো?",
    "question_type": "mcq",
    "paper_role": "mcq",
    "bloom_level": "Remember",
    "difficulty": "easy",
    "marks": 1,
    "options": [
      {
        "option_id": "ক",
        "text": "মদিনার হাজার হাজার মানুষ",
        "is_correct": true
      },
      {
        "option_id": "খ",
        "text": "শুধু তাঁর পরিবার",
        "is_correct": false,
        "why_wrong": "পাঠে শুধু পরিবারের কথা নেই"
      },
      {
        "option_id": "গ",
        "text": "মক্কার ব্যবসায়ীরা",
        "is_correct": false,
        "why_wrong": "পাঠে এই কথা নেই"
      },
      {
        "option_id": "ঘ",
        "text": "তায়েফের মানুষ",
        "is_correct": false,
        "why_wrong": "পাঠে তায়েফের কথা নেই"
      }
    ],
    "qid": "QP-BAN-C5-U21-Q05",
    "tier": "tier1"
  }
}