{
  "envelope_version": "1.0",
  "doc_type": "question",
  "subject": "BAN",
  "class_level": 5,
  "address": {
    "anchor_word": "Unit",
    "number": 18,
    "title": "পাঠ ১৮ — ইচ্ছামতী"
  },
  "curation_tag": "FLEXIBLE",
  "review_status": "draft",
  "tags": {
    "topic_tag": "TOP-BAN-C5-05",
    "bloom_level": "Remember",
    "difficulty": "easy",
    "paper_role": "mcq"
  },
  "provenance": {
    "source_project": "P04",
    "author": "Principal",
    "content_version": "1.0",
    "source_filename": "C5_Bangla_Source_13-23.md"
  },
  "payload": {
    "qid": "QP-BAN-C5-U18-Q30",
    "topic_tag": "TOP-BAN-C5-05",
    "ref19_topic_id": "BAN-POEM",
    "question_text": "'ইচ্ছামতী' কবিতাটির কবি কে?",
    "question_type": "mcq",
    "paper_role": "mcq",
    "bloom_level": "Remember",
    "difficulty": "easy",
    "tier": "tier1",
    "marks": 1,
    "chapter_ref": "পাঠ ১৮ — ইচ্ছামতী",
    "options": [
      {
        "option_id": "ক",
        "text": "রবীন্দ্রনাথ ঠাকুর",
        "is_correct": true
      },
      {
        "option_id": "খ",
        "text": "কাজী নজরুল ইসলাম",
        "is_correct": false,
        "why_wrong": "এই পাঠের শুরুতেই 'ইচ্ছামতী' কবিতার কবির নাম লেখা আছে — রবীন্দ্রনাথ ঠাকুর।"
      },
      {
        "option_id": "গ",
        "text": "আল মাহমুদ",
        "is_correct": false,
        "why_wrong": "পাঠ অনুযায়ী 'ইচ্ছামতী' কবিতার কবি রবীন্দ্রনাথ ঠাকুর।"
      },
      {
        "option_id": "ঘ",
        "text": "কাজী কাদের নেওয়াজ",
        "is_correct": false,
        "why_wrong": "পাঠে এই কবিতার কবি হিসেবে কেবল রবীন্দ্রনাথ ঠাকুরের নামই দেওয়া আছে।"
      }
    ]
  }
}