{
  "envelope_version": "1.0",
  "doc_type": "question",
  "subject": "BAN",
  "class_level": 5,
  "address": {
    "anchor_word": "Unit",
    "number": 14,
    "title": "পাঠ ১৪ — কুপোকাত"
  },
  "curation_tag": "FLEXIBLE",
  "review_status": "draft",
  "tags": {
    "topic_tag": "TOP-BAN-C5-09",
    "bloom_level": "Remember",
    "difficulty": "easy",
    "paper_role": "short"
  },
  "provenance": {
    "source_project": "P04",
    "author": "Principal",
    "content_version": "v1",
    "source_filename": "C5_BAN_U14_QuestionBank_v1.json"
  },
  "payload": {
    "qid": "QP-BAN-C5-U14-Q24",
    "topic_tag": "TOP-BAN-C5-09",
    "ref19_topic_id": "BAN-DRAMA",
    "question_text": "পশুদের অনুরোধে ______ বাঘের সঙ্গে আপস-রফা করেছিল। — শূন্যস্থান পূরণ করো।",
    "question_type": "fill_blank",
    "paper_role": "short",
    "bloom_level": "Remember",
    "difficulty": "easy",
    "tier": "tier1",
    "marks": 1,
    "chapter_ref": "পাঠ ১৪ — কুপোকাত",
    "blanks": [
      {
        "blank_no": 1,
        "accepted": [
          "শেয়াল"
        ]
      }
    ]
  }
}